Unnamed: 0,key,query,source,score
3646,PRIZM.docx@Nxt.docx,"address account, coded solomon-code associated with a secret passphrase is generated in the following way:

the secret passphrase is hashed using sha256 to retrieve the account's private key.","the reed-solomon-encoded account address associated with a secret passphrase is generated as follows:
the secret passphrase is hashed with sha256 to derive the account’s
private key.",0.844712257
3722,PRIZM.docx@Nxt.docx,"at the time of writing, it's a 25 btc reward, which is 10% inflation in the total bitcoin supply just this year.","at the time of writing, this stipend is 25 btc, producing 10% inflation in the total bitcoin supply this year alone.",0.841368914
3681,PRIZM.docx@Nxt.docx,"if the attack fails, the attempt is worthless because the coins are already sold or transferred; if the attack succeeds, the attacker gets his tokens back.","if the attack fails, the attempt costs nothing because the tokens have already been sold or traded; if the attack succeeds, the attacker gets their tokens back.",0.841126084
3603,PRIZM.docx@Nxt.docx,"the bitcoin 10 pool has reached 51% of bitcoin mining power in the past, and the top five bitcoin mining pools make up 70% of the hashing power of the network.","the ghash.io4 bitcoin pool has reached 51% of the bitcoin mining power in the past[10], and the top five bitcoinminingpoolsmakeup70%ofthebitcoinnetwork’shashingpower5.",0.838368535
3609,PRIZM.docx@Nxt.docx,"coins that meet this criterion contribute to an efficient account balance, and that balance is used to determine the probability of forging.","tokens that meet this criterion contribute to an account’s effective balance, and this balance is used to determine forging probability.",0.83585155
3621,PRIZM.docx@Nxt.docx,"blocks are scanned as they are received from other nodes, and in cases where a block check is not performed, the nodes can be ""black­ listed"" temporarily to prevent the dissemination of invalid block data.","blocks are validated as they are received from other nodes12, and in cases where block validation fails, nodes may be “blacklisted”temporarily to prevent the propagation of invalid block data.",0.831555247
3718,PRIZM.docx@Nxt.docx,"if all bitcoin mining rigs had ""mon­ arch"" levels, as described above and theywill not be until theyare upgradedtheywill representa pool of 30,000machinesworth more than$ 63 million.","if all bitcoin mining rigs had ""monarch"" levels of capability as described above which they will not, until they are upgraded they would represent a pool of 30,000 machines costing over $63 million usd and consuming over 10 megawatts of continuous power while running up an electricity bill of over $3.5 million usd per day51.",0.830095291
3614,PRIZM.docx@Nxt.docx,"the act of ""meet­ ing"" the block requires the consumption of the dignity of the coin age, and the net­ work determines the consensus by selecting the chain with the greatest total con­ sumed coin age.","the act of ""minting"" a block requires the consumption of coin age value, and the network determines consensus by selecting the chain with the largest total consumed coin age.",0.829712987
3618,PRIZM.docx@Nxt.docx,"the"" chance"" of cre­ ating a block by any account depends only on its current balance (which is the advan­ tage of each account), the time since the last block (which is shared by all forging ac­ counts) and the base target value (which is also common for all accounts







tokens
the initial em ission is 10 m illion pzm and the final amount is 6 b illion pzm.","an account’s ""chance"" to forge a block depends only on its effective balance (which is a property of each account), the time since the last block (which is shared by all forging accounts) and the base target value (which is also shared by all accounts).",0.829660892
3644,PRIZM.docx@Nxt.docx,"because the block data is distributed among the members (peers), forks (unauthorized chain fragments) are detected and dismantled by examining the cumulative complexity of the chains stored in each fork.","as block data is shared between peers, forks (non-authoritativechainfragments)aredetectedanddismantled by examining the chains’ cumulative difficulty values stored in each fork.",0.828424871
3605,PRIZM.docx@Nxt.docx,"the more coins you have in your account, the more likely it is that your account will be entitled to create a block.","the more tokens that are held in the account, the greater the chance that account will earn the right to generate a block.",0.820969105
3623,PRIZM.docx@Nxt.docx,"this workbook provides a permanent record of the transactions that have oc­ curred, and it also establishes the order in which the transactions were made.","this ledger provides a permanent record of transactions that have taken place,and also establishes the order in which transactions have occurred.",0.819763303
3680,PRIZM.docx@Nxt.docx,"attacks on history

in ""attack on history,"" someone acquires a large number of coins, sells them, and then tries to create a successful fork just before their coins have been sold or exchanged.","history attack

ina“historyattack”,someoneacquiresalargenumberoftokens,sellsthem, and then attempts to create a successful fork from just before the time when their tokens were sold or traded.",0.81731391
3637,PRIZM.docx@Nxt.docx,the consequence ofthis is that you can estimate the time it will take for any account toforce the block by comparing the hit value of that account to the target value.,the corollary of this is that you can estimate the time that will be required for any account to forge a block by comparing that account’s hit value to the target value.,0.816959798
3594,PRIZM.docx@Nxt.docx,"transactions are considered secure after 10 block confirmations, and the current archi­ tecture and block size of the pzm allow processing up to 367,200 transactions per day.","transactions are deemed safe after 10 block confirmations, andnxt’scurrentarchitectureand block size cap allows for the processing of up to 367,200 transactions per day.",0.816626191
3716,PRIZM.docx@Nxt.docx,"in mid-january 2014, the statistics stored on the site blockchain.info, showed that the continuoussupportof bitcoin operations requires a continu­ ous hash rate of about 18 million gh / s. within one day, this hashing power produced 1.5 trillion trial blocks, which were generated and rejected by bitcoin's mayonnaise, in search of one magical 144 blocks that will cover them $ 2.2 million.","during the course of one day, that much hashing power produced 1.5 trillion trial blocks that were generated and rejected by bitcoin miners looking for one the magic 144 blocks that would net them $2.2 million usd.",0.815175533
3642,PRIZM.docx@Nxt.docx,the payload that gen erates the account and all signatures on each block can be checked by all the network nodes that receive it.,"the payload value, generating account, and all of the signatures on each block can be verified by all network nodes who receive it.",0.814243078
3645,PRIZM.docx@Nxt.docx,"this format was implemented in response to concerns that an incorrect account address could result in coinsj aliases, or assets being irreversibly transferred to erroneous target accoun ts.","this format was implemented in response to concerns that

14for more information:




a mistyped account address could result in tokens, aliases, or assets being irreversibly transferred to erroneous destination accounts.",0.808745503
3674,PRIZM.docx@Nxt.docx,"if a transaction is not included in the block before it expires, it burns and is deleted from the transaction pool.","if a transaction has not been included in a block before the transaction deadline expires, the transaction is removed from the network.",0.806036353
3669,PRIZM.docx@Nxt.docx,"if the transaction was not included in the block before the transaction deadline, the transaction is removed from the network.","if a transaction is not included in a block before its deadline, it expires and is removed from the transaction pool.",0.804073095
3683,PRIZM.docx@Nxt.docx,the extreme form of this attack usually fails because the prizm blockchain cannot be reorganized by more than 720 blocks behind the current block height.,the extreme form of this attack generally fails because the nxt blockchain cannot be re-organized more than 720 blocksbehindthecurrent block height.,0.802842259
