Unnamed: 0,key,query,source,score
3636,PRIZM.docx@Nxt.docx,"even if there are only a few active accounts on the network, one of them will eventually generate a block because thetarget value will become very large.","even if there are only a few active accounts on the network, one of them will eventually generate a block because the target value will become very large.",0.99043262
3682,PRIZM.docx@Nxt.docx,extreme forms of this attack include obtaining private keys from old accounts and using them to build a successful chain directly from the genesis block.,extreme forms of this attack involve obtaining the private keys from old accounts and using them to build a successful chain right from the genesis block.,0.985868573
3628,PRIZM.docx@Nxt.docx,this target value and the base target value are the same for all accounts that are trying to to forge on top of a particular block.,this target value and the base target value are the same for all accounts attempting to forge on top of a specific block.,0.985325336
3650,PRIZM.docx@Nxt.docx,"when an account is accessed with a secret passphrase for the first time, it is not protected by a public key.","when an account is accessed by a secret passphrase for the very first time, it is not secured by a public key.",0.981446028
3667,PRIZM.docx@Nxt.docx,"because subsequent blocks are added to an existing blockchain, each additional block adds another confirmation to the number of transaction confirmations.","as subsequent blocks are added to the existing blockchain, each additional block adds one more confirmation to the number of confirmations for a transaction.",0.980278611
3710,PRIZM.docx@Nxt.docx,"asic technology is thepinnacle of the line for bitcoin miners, but the arms race continues with the advent of different generations of asic chips.","asic technology is the top of the line for bitcoin miners, but the arms race continues with various generations of asic chips now coming into service.",0.976528764
3714,PRIZM.docx@Nxt.docx,"in novem­ ber 2013, forbes magazine published an article titled "" global bitcoin computing power is 256 times faster than 500 combined supercomputers!"".","in november 2013, forbes magazine ran an article entitled, ""global bitcoin computing power now 256 times faster than top 500 supercomputers, combined!""[6].",0.97605139
3653,PRIZM.docx@Nxt.docx,"these collisions are detected and prevented as follows: after a certain passphrase is used to access the account, and the account is protected with a 256-bit public key, no other public-private key pair can access this account number.","these collisions are detected and prevented in the following way:once a specific passphrase is used to access an account, and that account is secured by a 256-bit public key, no other public-private key pair is permitted to access that account number.",0.975667119
3625,PRIZM.docx@Nxt.docx,"each transactionin a block is represented by a maximum of 160 bytes, and the maximum block size is 32 kb.","each transaction in a block is represented by a maximum of 160 bytes, and the maximum block size is 32kb.",0.974826694
3666,PRIZM.docx@Nxt.docx,"the newly created blocks are distributed to the network by the node (and the associated account) that creates them, and the transaction that is included in the block is considered to be one confirmation received.","newly-created blocks are distributed to the network by the node (and associated account) that creates them, and a transaction that is included in a block is considered as having received one confirmation.",0.973254442
3651,PRIZM.docx@Nxt.docx,"when the first outgoing transaction is made from the account, the 256-bit public key received from the passphrase is stored in the blockchain, and this protects the account.","when the first outgoing transaction from an account is made, the 256-bit public key derived from the passphrase is stored on the blockchain, and this secures the account.",0.971703589
3639,PRIZM.docx@Nxt.docx,"since any node can request an effective balance for any active account, it is possible to go through all active accounts to determine their individual hit value.","since any node can query the effective balance for any active account, it is possible to iterate through all active accounts in order to determine their individual hit value.",0.971518219
3704,PRIZM.docx@Nxt.docx,"this is done by ""hashing"" combining all bitcoin transactions occurring within the last ten minutes, and trying to encrypt them into a block of data, which also coincidentally has a certain number of consecutive zeros in it.","this is done by ""hashing"" bundling all bitcoin transactions occurring over the past ten minutes and trying to encrypt them into a block of data that also coincidentally has a certain number of consecutive zeros in it.",0.971213043
3673,PRIZM.docx@Nxt.docx,"if the transaction was not included in the block before the transaction deadline, the transaction is removed from the network.","if a transaction has not been included in a block before the transaction deadline expires, the transaction is removed from the network.",0.96972543
3705,PRIZM.docx@Nxt.docx,"most trial blocks generated by hashing miners do not have this target number of zeros, so they make small changes and try again.","most trial blocks generated by a miner’s hashing effort don’t have this target number of zeros, so they make a slight change and try again.",0.967646241
3622,PRIZM.docx@Nxt.docx,each node has built-in ddos protection mechanisms (distributed denial of services) that limit the number of network requests from any user to 30 per second.,each node features built-in ddos (distributed denial of services) defence mechanisms which restrict the number of network requests from any peer to 30 per second.,0.966953278
3719,PRIZM.docx@Nxt.docx,andthese numbers are now going up the exponential growth curve as bitcoin marches from its current one transaction per second to its current maximum of seven trans­ actions per second.,and these numbers are currently headed upward in an exponential growth curve as bitcoin marches from its current one transaction per second to its current maximum of seven transactions per second.,0.965329766
3627,PRIZM.docx@Nxt.docx,"the maximum target value is 1,53722867x 1017, andtheminimum target value is half the base target value of the previous block.",the maximum target value is 1.53722867 x 1017 and the minimum target value is one half of the previous block’s base target value.,0.96445936
3630,PRIZM.docx@Nxt.docx,"to participate in the forging process of a block, the active account cryptologically signs the previous generated block with its own public key.","to participate in the block forging process, an active account cryptographically signs the generation signature of the previous block with its own public key.",0.964394093
3607,PRIZM.docx@Nxt.docx,"blocks are linked by virtue of these links, creating a chain of blocks (and transactions) that can be traced back to the genesis block.","blocks are linked by virtue of these connections, creating a chain of blocks (and transactions) that can be traced all the
way back to the genesis block.",0.961706758
3689,PRIZM.docx@Nxt.docx,"about of transactions per day

by the end of 2013, thenumber of transactions processed in the bitcoin network reached a maximum of 70,000 per day, which is about 0.8 transactions per second (tps).","transactions per day
in late 2013, the number of transactions being processed on the bitcoin network was peaking at 70,000 per day, which is about 0.8 transactions per second (tps).",0.961154819
3665,PRIZM.docx@Nxt.docx,"wallet.dat

bitcoin and related currencies often use an encrypted file, under the name and wallet, to store generated addresses for receiving coins.","wallet.dat bitcoin and related currencies often use an encrypted file, called a wallet, to store generated addresses for receiving tokens.",0.957722008
3690,PRIZM.docx@Nxt.docx,"the current standard bitcoin block size of one megabyte, generated (on average) every ten minutes on the""full"" site ofcustomers, limits the maximum bandwidth ofthe existingbitcoin network to about 7 tps.","the current bitcoin standard block size of one megabyte, generated every ten minutes (on average) by “full node” clients, limits the maximum capacity of the current bitcoin network to a about 7 tps.",0.956620216
3616,PRIZM.docx@Nxt.docx,"as a result, the cost to attack the peercoin network is low, since the intruders can con­ tinue to try to generate blocks (called grinding the steak) until then, until they are successful.","as a result, the cost to attack the peercoin network is low, since attackers can keep attempting to generate blocks (referred to as grinding stake) until they succeed.",0.955031633
3686,PRIZM.docx@Nxt.docx,"blockchain size

the bitcoin blockchain is a complete sequential collection of the generated data blocks containing the e-book registers all bitcoin transactions that have taken place since its launch in january 2009th.","blockchain size
the bitcoin blockchain is the complete sequential collection of generated data blocks containing the electronic ledger book for all bitcoin transactions occurring since its launch in january 2009. four years later in january 2013, the size of the bitcoin blockchain stood at 4 gigabytes (gb) – about the amount of data required to store a two hour movie on a dvd disk.",0.948013842
3617,PRIZM.docx@Nxt.docx,"peercoin minimizes these and other risks by centrally publishing block­ chain checkpoints several times a day to ""freeze"" the blockchain and block transac­ tions.","peercoin minimizes these and other risks by centrally broadcasting blockchain checkpoints several times a day, to ""freeze"" the blockchain and lock in transactions[11].",0.946403801
3696,PRIZM.docx@Nxt.docx,"problems of centralization


the complexity increase and combined hash rate for bitcoin has created a high barrier to entry for newcomers, and lower profits for existing mining installations.","centralization concerns
the increasing difficulty42 and combined network hashrate43 for bitcoin has created a high barrier to entry for newcomers, and diminished returns for existing mining rigs.",0.942487538
3652,PRIZM.docx@Nxt.docx,"the address space for public keys (2256) is larger than the address space for account numbers (264), so there is no one-to-one matching of code words to account numbers and possible collisions.","the address space for public keys (2256) is larger than the address space for account numbers (264), so there is no one-to-one mapping of passphrases to account numbers and collisions are possible.",0.942367315
3658,PRIZM.docx@Nxt.docx,"in addition, the"" account leasing ""function allows you to set an effective balance on another account for a temporary period.","in addition, the account leasing feature allows an account’s effective balance to be assigned to another account for a temporary period.",0.936874986
3612,PRIZM.docx@Nxt.docx,"due tothe extremely low probability that any account will take over the blockchain managementby creating its own chain of blocks, transactions are considered safe if they are encoded into a block that is 10 blocks lo­ cated behind the current block.","due to the extremely low probability of any account taking control of the blockchain by generating its own chain of blocks, transactions are deemed safe once they are encoded into a block that is 10 blocks behind the current block height.",0.936598957
3601,PRIZM.docx@Nxt.docx,but no one could predict that the incentives provided by proof of work systems would lead to the centralization of the mining process.,"], but nobody could have predicted that the incentives provided by proof of work systems would result in the centralization of the mining process.",0.934246063
3688,PRIZM.docx@Nxt.docx,"eighteen months later, in july 2014th, the bitcoin blockchain size increasedby almost five-to 19 gigabytes (gb) 37. bitcoin blockchain is undergo­ ing exponential growth, and modifications to the original bitcoin protocol will require a solution to this.","eighteen months later, in july 2014, the size of the bitcoin blockchain had swelled by almost a factor of five to 19 gigabytes (gb)37. the bitcoin blockchain is undergoing exponential growth and modifications to the original bitcoin protocol will be required to deal with it.",0.932725549
3675,PRIZM.docx@Nxt.docx,"transactions can be left unconfirmed because they are invalid or distorted, or because blocks are filled with transactions that offer to pay a higher commission.","transactions may be left unconfirmed because they are invalid or malformed, or because blocks are being filled will transactions that have offered to pay higher transaction fees.",0.931061864
3597,PRIZM.docx@Nxt.docx,"as the proof of work network develops, the individual user has less incentive to support the network, as their potential reward is distributed among more colleagues.","as a proof of work network becomes stronger, there is less incentive for an individual peer to support the network, because their potential reward is split among a greater number of peers.",0.928623557
3672,PRIZM.docx@Nxt.docx,a transaction that was sent to the network but was not included in the block is called an unconfirmed transaction.,a transaction that has been broadcast to the network but has not been included in a block is referred to as an unconfirmed transaction.,0.924393415
3692,PRIZM.docx@Nxt.docx,"time to confirm transaction

transaction confirmation times for bitcoin ranged from 5 to 10 min­ utes for the most part during 2013. after the announcement at the end of 2013th that chinese banks would not be allowed to process bitcoins, the average bitcoin transaction time increased signifi­ cantly, to 8-13 minutes, with periodic peaks of 19 minutes.","transaction confirmation time
transaction confirmation times for bitcoin ranged from 5 to 10 minutes for most of 2013. after the late 2013 announcement that chinese banks would not be
38https://nxtblocks.info/#section/blockexplorer_blocks
39https://en.bitcoin.it/wiki/thin_client_security
40https://en.bitcoin.it/wiki/scalability#simplified_payment_verification




allowed to process bitcoins, the average bitcoin transaction time significantly increased to 8 to 13 minutes, with occasional peaks of 19 minutes41.",0.922706783
3723,PRIZM.docx@Nxt.docx,"for every$ 1,000 bitcoin that it belongs to, this person pays
$100 for bitcoin this year to ""pay"" miners for network security.","for each $1000usd worth of bitcoin someone owns, that person is paying $100usd per bitcoin this year to ""pay"" miners for keeping the network secure.",0.918969274
3640,PRIZM.docx@Nxt.docx,"interestingly, the new base target for the next block cannot be reasonably predicted, so a virtually deterministic process of determining who will force the next block becomes more and more sto­ chastic as attempts are made to predict future blocks.","interestingly, the new base target value for the next block cannot be reasonably predicted, so the nearly-deterministic process of determining who will forge the next block becomes increasingly stochastic as attempts are made to predict future blocks.",0.914810538
3707,PRIZM.docx@Nxt.docx,"with so much money on the bet, miners supported the rapid arms race in mining rig technology to improve their chances ofwinning.","with so much money at stake, miners have supported a blistering arms race in mining rig technology to better their odds of winning.",0.913719773
3590,PRIZM.docx@Nxt.docx,"however, for the entire e-economy to be based on a fully decentralized peer-to-peer solution, the system must be able to do the following:


process transactions securely, quickly and efficiently, in the amount of thousands per hour or more;
encourage people to participate in network security;
scale at the global level with the minimum consumption of resources;
and to be able to work on a wide range of devices including mobile.","however, for an entire electronic economy to be based on a fully decentralized, peer-to-peer solution, it must be able to do the following: process transactions securely, quickly and efficiently, at the rate of thousands per hour or more; provide incentives for people to participate in securing the network; scale globally with a minimal resource footprint; offer a range of basic transaction types that launch cryptocurrencies past the core feature of a payment system alone; provide an agile architecture that facilitates the addition of new core features, and allows for the creation and deployment of advanced applications; and be able to run on a broad range of devices, including mobile ones.",0.904045463
3670,PRIZM.docx@Nxt.docx,"the timing of the transaction

each transaction contains a deadline parameter set to the number of minutes since thetransactionwas sent to the network.","transaction deadlines every transaction contains a deadline parameter, set to a number of minutes from the time the transaction is submitted to the network.",0.901802599
3620,PRIZM.docx@Nxt.docx,"while an attacker might want to mark a node to gain trust on the network and then use that trust for malicious purposes, the barrier to entry (the cost of pzm needed to build adequate trust) prevents such abuse.",while an attacker might wish to hallmark a node in order to gain trustworthiness within the network and then use that trust for malicious purposes; the barrier to entry (cost of nxt required to build adequate trust) discourages such abuse.,0.901788414
3608,PRIZM.docx@Nxt.docx,"block generation time is approximately 59 seconds, but changes in the probabilities have led to the fact that the average gen­ eration time of the block can be 80 seconds, there are longer intervals of blocks.","block generation time is targeted at 60 seconds, but variations in probabilities have resulted in an average block generation time of 80 seconds, with occasionally very long block intervals.",0.900760055
3668,PRIZM.docx@Nxt.docx,"if a transaction is not included in the block before it expires, it burns and is deleted from the transaction pool.","if a transaction is not included in a block before its deadline, it expires and is removed from the transaction pool.",0.897803307
3715,PRIZM.docx@Nxt.docx,"in mid-january 2014, the statistics stored on the site blockchain.info, showed that the continuoussupportof bitcoin operations requires a continu­ ous hash rate of about 18 million gh / s. within one day, this hashing power produced 1.5 trillion trial blocks, which were generated and rejected by bitcoin's mayonnaise, in search of one magical 144 blocks that will cover them $ 2.2 million.","in mid january 2014, statistics maintained at blockchain.info showed that ongoing support of bitcoin operations required a continuous hash rate of around 18 million gh/sec.",0.895865619
3626,PRIZM.docx@Nxt.docx,"this value is equal:
t tb x s x be




the reference target value



the elapsed time since the last block in seconds




the effective account balance





as you can see from the formula, the target value increases with every second that has passed since the previous block.","this value is:

t = tb × s × be
where:
t	is the new target value
tb	is the base target value
s	is the time since the last block, in seconds be	is the effective balance of the account
13see 2.4.1 for an explanation of these parameters and how they are used.",0.894979179
3694,PRIZM.docx@Nxt.docx,"how­ ever, since several checks (usually six preferred confirmations) are required to complete a bitcoin transaction,one hourcan easily pass before the sale of assets paid for by bitcoin is completed.","nonetheless, since multiple verifications are required to finalize a bitcoin transaction (six confirmations is generally preferred), one hour can easily pass before a sale of assets paid for by bitcoin is complete.",0.890970826
3599,PRIZM.docx@Nxt.docx,"over time, the network becomes more centralized as smaller partners (those who can do less work) drop out or pool their resources into pools.","as time progresses, the network becomes more and more centralized as smaller peers (those who can do less work) drop out or combine their resources into ""pools"".",0.889952302
3598,PRIZM.docx@Nxt.docx,"in search of profitability miners continue to invest resources in the form of specialized, patented equipment that requires significant investment and high current energy costs.","in search of profitability, miners keep adding resources in the form of specialized, proprietary hardware that requires significant capital investment and high ongoing energy demands.",0.876095116
3713,PRIZM.docx@Nxt.docx,"bitcoin asic is similar to autistic scientists they can only perform the calculation of a block of bitcoins and nothing more, butthey can do it with onecalculation at the speeds of a supercomputer.","bitcoin asics are like autistic savants they are able to do only the bitcoin block calculation and nothing more, but they can do that one calculation at supercomputer speeds.",0.875592768
3698,PRIZM.docx@Nxt.docx,"not only does this create the kind of power structure that bit­ coin has designed to bypass, but it also presents the real possi­ bility that a single mining operation or pool can gain 51% of the total mining capacity in the 46 network and perform a 51% attack.","not only does this create the kind of power structure that bitcoin was designed to circumvent, but it also presents the real possibility that a single mining operation or pool could amass 51% of the network’s total mining power46 and execute a 51% attack[9].",0.875053048
3643,PRIZM.docx@Nxt.docx,"in a situation where multiple blocks are generated, nodes will select the block with the highest ac­ cumulated complexity as the authoritative block.","in a situation where multiple blocks are generated, nodes will select the block with the highest cumulative difficulty value as the authoritative block.",0.873386383
3610,PRIZM.docx@Nxt.docx,"to prevent an attacker from creating a new chain all the way from the genesis block, the network allows only the restructuring of the chain of 720 blocks located behind the current block.","to keep an attacker from generating a new chain all the way from the genesis block, the network only allows chain re-organization 720 blocks behind the current block height.",0.872475207
3697,PRIZM.docx@Nxt.docx,"the incentive to encourage blocks used by bitcoin has led to the creation of large single-tier installations of specialized mining equipment 44, as well as reli­ ance on a small set of large mining pools 45. this led to the effect of"" centralization"", where large volumes of mining are concentrated in the control of a decreasing number of people.","the block reward incentive employed by bitcoin has driven the creation of large, single-owner installations of dedicated mining hardware44, as well as the reliance on a small set of large mining pools45.",0.868042827
3701,PRIZM.docx@Nxt.docx,"a few days later, the power in the pool decreased to 34% of the total capacity of the network, but the speed immediately began to increase, and in june 2014 again reached dangerous levels.","after a few days, the pool’s mining power was reduced to 34% of the total network power, but the rate immediately began to increase again, and once more reached dangerous levels in june 2014[5].",0.861745298
3687,PRIZM.docx@Nxt.docx,"four years later, in january 2013th, bitcoin's blockchain size was 4 gigabytes (gb) the approximate amount ofdata needed tostore a two-hourmovie on a dvd.","blockchain size
the bitcoin blockchain is the complete sequential collection of generated data blocks containing the electronic ledger book for all bitcoin transactions occurring since its launch in january 2009. four years later in january 2013, the size of the bitcoin blockchain stood at 4 gigabytes (gb) – about the amount of data required to store a two hour movie on a dvd disk.",0.859327793
3591,PRIZM.docx@Nxt.docx,"curve25519 cryptographyis used toprovide a balance of security and the required processing power along with the more commonly used sha256 hashing algo rit hm s.



te	ies

pr	i z m

in the traditional ""proof of work"" modelused by the majority of cryptocurrencies, network security is ensured by participants performing ""work"".","curve25519 cryptography is used to provide a balance of security and required processing power, along with more commonly-used sha256 hashing algorithms.",0.858682811
3712,PRIZM.docx@Nxt.docx,"they should be replaced by 20nm asic modules by the end of 2014. an example of a new state of the art mining rig would be a 28nm asic card ""the monarch"" from butterfly labs, which is to provide 600gh / sec for an electricity consumption of 350 watts and a price of 2,200 usd.","an example of an upcoming state-of-the-art mining rig would be a butterfly labs ""monarch"" 28nm asic card, which is to provide 600gh/sec for an electricity consumption of 350 watts and a price of $2200usd50.",0.857843995
3619,PRIZM.docx@Nxt.docx,"the more the balance of account is linked to a marked node, the more confidence is given to this node.","the larger the balance of an account tied to a hallmarked node, the more trust is given to that node.",0.854819357
3720,PRIZM.docx@Nxt.docx,"the cost of pow maintaining relating to the coins' holders
in addition to the huge costs of electricity, there is a hidden fee for the simple storage of bitcoins.","proof of work’s resource costs pertaining to coinholders
in addition to massive electrical costs, there is a hidden fee for simply holding bitcoins.",0.850323915
